kanji,english,explanation,primitive
一,one,"In Chinese characters, the number **one** is laid on its side, unlike the Roman numeral I which stands upright. As you would expect, it is written from left to right.","* As a primitive element, the key-word meaning is discarded, and the single horizontal stroke takes on the meaning of _floor_ or _ceiling_ , depending on its position: if it stands above another primitive, it means _ceiling_ , if below, _floor_."
二,two,"Like the Roman numeral II, which reduplicates the numeral I, the kanji for **two** is a simple reduplication of the horizontal stroke that means one. The order of writing goes from above to below, with the first stroke slightly shorter.",
三,three,"And like the Roman numeral III, which triples the numeral I, the kanji for **three** simply triples the single horizontal stroke. In writing it, think of ""1 + 2 = 3"" (一 + 二 = 三) in order to keep the middle stroke shorter.",
四,four,"This character is composed of two primitive elements, _mouth_ and _human legs_ , both of which we will meet in the coming lessons. Assuming that you already knew how to write this kanji, we will pass over the ""story"" connected with it until later. Note how the second stroke is written left-to-right and then top- to-bottom. This is consistent with what we have already seen in the first three numbers and leads us to a general principle that will be helpful when we come to more complicated kanji later on: write north-to-south, west-to-east, northwest-to-southeast.",
五,five,"As with _four_ , we shall postpone learning the primitive elements that make up this character. Note how the general principle we just learned in the preceding frame applies to the writing of the character for **five**.",
六,six,"The primitives here are _top hat_ and _animal legs_. Once again, we glide over them until later.",
七,seven,"Note that the first stroke ""cuts"" through the second. This distinguishes **seven** from the character for _spoon_  (Frame 476), in which the horizontal stroke stops short.","* As a primitive, this form takes on the meaning of _diced_ , i.e., ""cut"" into little pieces, consistent both with the way the character is written and with its association with the kanji for _cut_ to be learned in a later lesson (Frame 89)."
八,eight,"Just as the Arabic numeral ""8"" is composed of a small circle followed by a larger one, so the kanji for **eight** is composed of a short line followed by a longer line, slanting towards it but not touching it. And just as the  ""lazy 8"" is the mathematical symbol for ""infinity,"" so the expanse opened up below these two strokes is associated by the Japanese with the sense of an infinite expanse or something ""all-encompassing.""",
九,nine,"If you take care to remember the stroke order of this kanji, you will not have trouble later keeping it distinct from the kanji for _power_ (Frame 922).","* As a primitive, we shall use this kanji to mean _baseball team_ or simply _baseball_. The meaning, of course, is derived from the _nine_ players who make up a team."
十,ten,Turn this character 45 degrees either way and you have the x used for the Roman numeral **ten**.,"* As a primitive, this character sometimes keeps its meaning of _ten_ and sometimes signifies _needle_ , this latter derived from the kanji for _needle_ (Frame 292). Since the primitive is used in the kanji itself, there is no need to worry about confusing the two. In fact, we shall be following this procedure regularly."
口,mouth,"Like several of the first characters we shall learn, the kanji for **mouth** is a clear pictograph. Since there are no circular shapes in the kanji, the square must be used to depict the circle.","* As a primitive, this form also means _mouth_. Any of the range of possible images that the word suggests - an opening or entrance to a cave, a river, a bottle, or even the largest hole in your head - can be used for the primitive meaning."
日,day,"This kanji is intended to be a pictograph of the sun. Recalling what we said in the previous frame about round forms, it is easy to detect the circle and the big smile that characterize our simplest drawings of the sun - like those yellow badges with the words, ""Have a nice **day**! ""","* Used as a primitive, this kanji can mean _sun_ or _day_ or a _tongue wagging in the mouth_. This latter meaning, incidentally, derives from an old character outside the standard list meaning something like  ""sayeth"" and written almost exactly the same, except that the stroke in the middle does not touch the right side (Frame 620)."
月,month,"This character is actually a picture of the moon, with the two horizontal lines representing the left eye and mouth of the mythical ""man in the moon."" (Actually, the Japanese see a hare in the moon, but it is a little farfetched to find one in the kanji.) And one **month** , of course, is one cycle of the moon.","* As a primitive element, this character can take on the sense of _moon_ , _flesh_ , or _part of the body_. The reasons for the latter two meanings will be explained in a later chapter."
田,rice field,"Another pictograph, this kanji looks like a bird's-eye view of a **rice field** divided into four plots. Be careful when writing this character to get the order of the strokes correct. You will find that it follows perfectly the principle stated in frame 4.","* When used as a primitive element, the meaning of _rice field_ is most common, but now and again it will take the meaning of _brains_ from the fact that it looks a bit like that tangle of gray matter nestled under our skulls."
目,eye,"Here again, if we round out the corners of this kanji and curve the middle strokes upwards and downwards respectively, we get something resembling an **eye**.","* As a primitive, the kanji keeps its sense of _eye_ , or more specifically, an _eyeball_. When placed in the surroundings of a complex kanji, the primitive will sometimes be turned on its side."
古,old,"The primitive elements that compose this character are _ten_ and _mouth_ , but you may find it easier to remember it as a pictograph of a tombstone with a cross on top. Just think back to one of those graveyards you have visited, or better still, used to play in as a child, with **old** inscriptions on the tombstones. This departure from the primitive elements in favor of a pictograph will take place now and again at these early stages, and almost never after that. So you need not worry about cluttering up your memory with too many character  ""drawings.""","* Used as a primitive element, this kanji keeps its key-word sense of _old_ , but care should be taken to make that abstract notion as graphic as possible."
吾,I,"There are actually a number of kanji for the word **I** , but the others tend to be more specific than this one. The key word here should be taken in the general psychological sense of the ""perceiving subject."" Now the one place in our bodies that all _five_ senses are concentrated in is the head, which has no less than _five mouths_ : 2 nostrils, 2 ears, and 1 mouth. Hence, _five mouths_ = **I**.",
冒,risk,"Remember when you were young and your mother told you never to look directly into the _sun_ for fear you might burn out your _eyes_? Probably you were foolish enough to **risk** a quick glance once or twice, but just as probably, you passed that bit of folk wisdom on to someone else as you grew older. Here, too, the kanji that has a _sun_ above and an _eye_ right below looking up at it has the meaning of **risk** (see frame 12).",
朋,companion,"The first **companion** that God made, as the Bible story goes, was Eve. Upon seeing her, Adam exclaimed,  "" _Flesh_ of my _flesh_! "" And that is precisely what this character says in so many strokes.",
明,bright,"Among nature's **bright** lights, there are two that the biblical myth has God set in the sky: the _sun_ to rule over the day and the _moon_ to rule the night. Each of them has come to represent one of the common connotations of this key word: the _sun_ , the **bright** insight of the clear thinker, and the _moon_ , the **bright** intuition of the poet and the seer (see frame 13).",
唱,chant,"This one is easy! You have one _mouth_ making no noise (the choirmaster) and two _mouths with wagging tongues_ (the minimum for a chorus). So think of the key word, **chant** , as monastery singing and the kanji is yours forever (see frame 11).",
晶,sparkle,"What else can the word **sparkle** suggest if not a diamond? And if you've ever held a diamond up to the light, you will have noticed how every facet of it becomes like a miniature _sun_. This kanji is a picture of a tiny _sun_ in three places (that is,  ""everywhere""), to give the sense of something that **sparkles** on all sides. Just like a diamond. In writing the primitive elements three times, note again how the rule for writing given in frame 4 holds true not only for the strokes in each individual element but also for the disposition of the elements in the character as a whole.",
品,goods,"As in the character for _sparkle_ , the triplication of a single element in this character indicates ""everywhere"" or ""heaps of."" When we think of **goods** in modern industrial society, we think of what has been mass- produced - that is to say, produced for the  ""masses"" of open _mouths_ waiting like fledglings in a nest to  ""consume"" whatever comes their way.",
呂,spine,This character is rather like a picture of two of the vertebrae in the **spine** linked by a single stroke.,
昌,prosperous,"What we mentioned in the previous two frames about 3 of something meaning ""everywhere"" or ""heaps of"" was not meant to be taken lightly. In this kanji we see _two suns_ , one atop the other, which, if we are not careful, is easily confused in memory with the _three suns_ of _sparkle_. Focus on the number this way: since we speak of **prosperous** times as _sunny_ , what could be more **prosperous** than a sky with _two suns_ in it? Just be sure to actually SEE them there.",
早,early,"This kanji is actually a picture of the first flower of the day, which we shall, in defiance of botanical science, call the _sun_ flower, since it begins with the element for _sun_ and is held upon a stem with leaves (the pictographic representation of the final two strokes). This time, however, we shall ignore the pictograph and imagine _sun_ flowers with _needles_ for stems, which can be plucked and used to darn your socks. The sense of **early** is easily remembered if one thinks of the _sun_ flower as the **early** riser in the garden, because the _sun_ , showing favoritism towards its namesake, shines on it before all the others (see frame 10).","* As a primitive element, this kanji takes the meaning of _sunflower_ , which was used to make the abstract key word _early_ more graphic."
旭,rising sun,"This character is a sort of nickname for the Japanese flag with its well-known emblem of the **rising sun**. If you can picture two seams running down that great red _sun_ , and then imagine it sitting on a _baseball_ bat for a flagpole, you have a slightly irreverent - but not altogether inaccurate - picture of how the sport has caught on in the Land of the **Rising Sun**.",
世,generation,"We generally consider one **generation** as a period of thirty (or _ten_ plus _ten_ plus _ten_ ) years. If you look at this kanji in its completed form - not in its stroke order - you will see three _tens_. When writing it, think of the lower horizontal lines as  ""addition"" lines written under numbers to add them up. Thus: _ten_ ""plus"" _ten_ ""plus"" _ten_ = thirty. Actually, it's a lot easier doing it with a pencil than reading it in a book.",
胃,stomach,"You will need to refer back to frames 13 and 14 here for the special meaning of the two primitive elements that make up this character: _flesh_ ( _part of the body_ ) and _brain_. What the kanji says, if you look at it, is that the _part of the body_ that keeps the _brain_ in working order is the **stomach**. To keep the elements in proper order, when you write this kanji think of the _brain_ as being  ""held up"" by the _flesh_.",
旦,nightbreak,"While we normally refer to the start of the day as ""daybreak,"" Japanese commonly refers to it as the ""opening up of night"" into day. Hence the choice of this rather odd key word, **nightbreak**. The single stroke at the bottom represents the _floor_ (have a peek again at frame 1) or the horizon over which the _sun_ is poking its head",
胆,gall bladder,"The pieces in this character should be easily recognizable: on the left, the element for _part of the body_ , and on the right, the character for _nightbreak_ , which we have just met. What all of this has to do with the **gall bladder** is not immediately clear. But all we need to do is give a slight twist to the traditional biblical advice about not letting the sun set on your anger (which ancient medicine associated with the choler or bile that the **gall bladder** is supposed to filter out), and change it to  ""not letting the _night break_ on your anger "" (or your **gall** ) - and the work of remembering the kanji is done. And the improvement is not a bad piece of advice in its own right, since anger, like so many other things, can often be calmed by letting the sun set on it and then ""sleeping it off.""",
亘,span,"Sunrise, sunset, sunrise, sunset... goes the song of the Fiddler on the Roof. You can almost see the journey of the sun as it moves from one horizon (the _floor_ ) to its noonday heights in the sky overhead ( _ceiling_ ) and then disappears over the other horizon - day after day, marking the **span** of our lives.",
凹,concave,"You couldn't have asked for a better key word for this kanji! Just have a look at it: a perfect image of a **concave** lens (remembering, of course, that the kanji square off rounded things), complete with its own little  ""cave."" Now all you have to do is learn how to write it.",
凸,convex,"Maybe this helps you see how the Japanese have no trouble keeping **convex** distinct from _concave_. Note the odd feeling of the third stroke. If it doesn't feel all that strange now, by the time you are done with this book, it will. There are very few times you will have to write it.",
旧,olden times,"A _walking stick_ is needed for _days_ of **olden times** , since _days_ , too, get old - at least insofar as we refer to them as the ""good old days."" The main thing here is to think of ""good old days"" when you hear the key word **olden times**. The rest will take care of itself.",
自,oneself,"You can think of this kanji as a stylized pictograph of the nose, that little _drop_ that Mother Nature set between your _eyes_. The Japanese refer to themselves by pointing a finger at their nose - giving us an easy way to remember the kanji for **oneself**.","* The same meaning of _oneself_ can be kept when this kanji is used as a primitive element, but you will generally find it better to give it the meaning of _nose_ or _nostrils_ , both because it accords with the story above and because it is the first part of the kanji for _nose_ (Frame 733)."
白,white,"The color **white** is a mixture of all the primary colors, both for pigments and for light, as we see when a prism breaks up the rays of the sun. Hence, a single _drop_ of _sun_ spells **white**.","* As a primitive, this character can either retain its meaning of _white_ or take the more graphic meaning of a _white bird_ or _dove_. This latter stems from the fact that it appears at the top of the kanji for _bird_ , which we shall get to later (Frame 2091)."
百,hundred,"The Japanese refer to a person's 99th birthday as a "" _white_ year "" because _white_ is the kanji you are left with if you subtract _one_ from a **hundred**.",
中,in,"The elements here are a _walking stick_ and a _mouth_. Remember the trouble your mother had getting medicine **in** your _mouth_? Chances are it crossed her mind more than once to grab something handy, like your grandfather's _walking stick_ , to pry open your jaws while she performed her duty. Keep the image of getting something **in** from the outside, and the otherwise abstract sense of this key word should be a lot easier than trying to spoon castor oil **in** to a baby's mouth.",
千,thousand,"This kanji is almost too simple to pull apart, but for the sake of practice, have a look at the _drop_ above and the _ten_ below. Now put the elements together by thinking of squeezing two more zeros out of an _eyedropper_ alongside the number _ten_ to make it a **thousand**.",
舌,tongue,"The primitive for _mouth_ and the character for _thousand_ naturally form the idea of **tongue** if one thinks of a _thousand mouths_ able to speak the same language, or as we say,  ""sharing a common **tongue**. "" It is easy to see the connection between the idiom and the kanji if you take its image literally: a single **tongue** being passed around from _mouth_ to _mouth_.",
升,measuring box,"This is the character for the little wooden box that the Japanese use for measuring things, as well as for drinking saké out of. Simply imagine the outside as spiked with a _thousand_ sharp _needles_ , and the quaint little **measuring box** becomes a drinker's nightmare! Be very careful when you write this character not to confuse it with the writing of _thousand_. The reason for the difference gives us a chance to clarify another general principle of writing that supersedes the one we mentioned in frame 4: when a single stroke runs vertically through the middle of a character, it is written last.",
昇,rise up,"Our image here is made up of two primitive elements: a _sun_ and a _measuring box_. Just as the _sun_ can be seen **rising up** in the morning from - where else - the Land of the Rising Sun, this kanji has the _sun_ **rising up** out of a Japanese _measuring box_  \- the "" _measuring box_ of the **rising-up** _sun_. """,
丸,round,"We speak of "" **round** numbers, "" or "" **rounding** a number off, "" meaning to add an insignificant amount to bring it to the nearest 10. For instance, if you add just a wee bit, the tiniest _drop_ , to _nine_ , you end up with a **round** number.","* As a primitive, this element takes the meaning of a _fat man_. Think of a grotesquely _fat man_ whose paunch so covers the plate that he is always getting hit by the pitch. Hence a _round baseball player_ becomes a _fat man_."
寸,measurement,"This kanji actually stood for a small **measurement** used prior to the metric system, a bit over an inch in length, and from there acquired the sense of **measurement**. In the old system, it was one- _tenth_ of a _shaku_ (whose kanji we shall meet in frame 1151). The picture, appropriately, represents one _drop_ of a _ten_  (with a hook!).","* As a primitive, we shall use this to mean _glue_ or _glued to_. There is no need to devise a story to remember this, since the primitive will appear so often you would have to struggle hard NOT to remember it."
肘,elbow,"Instead of the familiar ""grease"" we usually associate with the **elbow** of someone hard at work, the kanji gives us a _part of the body_ that has been _glued to_ its task.",
専,specialty,"_Ten_ . . . _rice fields_ . . . _glue_. That is how one would read the primitive elements of this kanji from top to bottom. Now if we make a simple sentence out of these elements, we get:  "" _Ten rice fields glued_ together. "" A **specialty** , of course, refers to one's special "" _field_ "" of endeavor or competence. In fact, few people remain content with a single **specialty** and usually extend themselves in other _fields_ as well. This is how we come to get the picture of _ten fields glued_ together to represent a **specialty**.",
博,Dr.,"At the left we have the _needle_ , at the right, the kanji for _specialty_ , plus an extra _drop_ at the top. Think of a **Dr.** who is a _specialist_ with a _needle_ (an acupuncturist) and let the _drop_ at the top represent the period at the end of **Dr.** In principle we are trying to avoid this kind of device, which plays on abstract grammatical conventions, but I think you will agree, after you have had occasion to use the right side of this kanji in forming other kanji, that the exception is merited in this case.",* The primitive form of this kanji eliminates the _needle_ on the left and gets the meaning of an _acupuncturist_.
占,fortune-telling,"This is one of those kanji that is a real joy of simplicity: a _divining rod_ with a _mouth_  \- which translate directly into **fortune-telling**. Note how the movement from top to bottom (the movement in which the kanji are written) is also the order of the elements which make up our story and of the key word itself: first _divining rod_ , then _mouth_. This will not always be possible, but where it is, memory has almost no work at all to do.",
上,above,"The two directions, **above** and below, are usually pointed at with the finger. But the characters do not follow that custom, so we have to choose something else, easily remembered. The primitives show a _magic wand_ standing **_above_** a _floor_  \- ""magically,"" you might say. Anyway, go right on to the next frame, since the two belong together and are best remembered as a unit, just as the words **above** and _below_ suggest each other.",
下,below,"Here we see our famous miraculous _magic wand_ hanging, all on its own, **below** the _ceiling_ , as you probably already guessed would happen. In addition to giving us two new kanji, the two shapes given in this and the preceding frame also serve to fix the use of the primitives for _ceiling_ and _floor_ , by drawing our attention successively to the line standing above and **below** the primitive element to which it is related.",
卓,eminent,The word **eminent** suggests a famous or well-known person. So all you need to do - given the primitives of a _magic wand_ and a _sunflower_  \- is to think of the world's most **eminent** magician as one who uses a _sunflower_ for a _magic wand_ (like a flower-child who goes around turning the world into peace and love).,
朝,morning,"On the right we see the _moon_ fading off into the first light of **morning** , and to the left, the _mist_ that falls to give nature a shower to prepare it for the coming heat. If you can think of the _moon_ tilting over to spill _mist_ on your garden, you should have no trouble remembering which of all the elements in this story are to serve as primitives for constructing the character.",
嘲,derision,"The bad feeling created by words spoken in **derision** often leaves a bad taste in the _mouth_ of the one who speaks them, kind of like the foul aftertaste that follows a night before of too much of the wrong stuff - or what we call _morning mouth_.",
只,only,"When we run across abstract key words like this one, the best way to get an image it to recall some common but suggestive phrase in which the word appears. For instance, we can think of the expression ""it's the **only** one of its kind. "" Then we imagine a barker at a side-show advertising some strange pac-manlike creature he has inside his tent, with only a gigantic _mouth_ and two wee _animal legs_.",
貝,shellfish,"To remember the primitive elements that make up this kanji, an _eye_ and _animal legs_ , you might be tempted to think of it as a pictograph of a **shellfish** with its ridged shell at the top and two little _legs_ sticking out of the bottom. But that might not help you recall later just how many ridges to put on the shell. Better to imagine a freakish **shellfish** with a single, gigantic _eye_ roaming the beaches on its slender little _legs_ , scaring the wits out of the sunbathers.","* When used as a primitive, in addition to _shells_ , the meanings _oyster_ and _clam_ will often come in handy."
唄,pop song,"There is a lot of money to be made of one's **songs** are  "" **pop** ular."" This is depicted here as a stream of _clams_ spewing out of the _mouth_ of someone performing a **pop song**.",
貞,upright,"Now take the last primitive, the _shellfish_ , and set a _magic wand_ over it, and you have the kanji for **upright**. After all, the _clam_ and the _oyster_ are incapable of walking **upright**. It would take a magician with his _wand_ to pull off such a feat - which is precisely what we have in this kanji.",
員,employee,"How do we get a _mouth_ over a _shellfish_ to mean an **employee**? Simple. Just remember the advice new **employees** get about keeping their _mouths_ shut and doing their job, and then make that more graphic by picturing an office building full of white collar workers scurrying around with _clams_ pinched to their _mouths_.",
貼,post a bill,"The key word in this frame has do with **posting bills** to a billboard. In this case, the billboard is standing at the exit to a Chinese restaurant displaying the latest alternative to the tradition _fortune-telling_ cookies. Look closely and you will see rows of leftover shells of _clams_ with little slips of paper sticking out of them **posted** to the billboard.",
見,see,"The elements that compose the character for **see** are the _eye_ firmly fixed to a pair of _human legs_. Surely, somewhere in your experience, there is a vivid image just waiting to be dragged up to help you remember this character....",
児,newborn babe,"The top part of the kanji in this frame, you will remember, is the character for _olden times_ , those _days_ so old they needed a _walking stick_ to get around. Western mythical imagination has old  ""Father Time"" leaning on his sickle with a **newborn babe** crawling around his _legs_ , the idea being that the circle of birth and-death goes on. This is the first of three times that the kanji for _olden times_ will appear as a primitive element in another kanji, so try to make the most of it.",
