kanji,english,explanation,primitive
漁,fishing,"To the story we have just made about _fish_ , this kanji for the profession of **fishing** adds yet another element BEFORE the others: namely the _water_ , where the fish was happily at home before being caught, disemboweled, and eaten. Be sure to get a clear image of the _water_  when you put it all together.",
里,ri,"That's right - a **_ri_**. Don't bother looking it up in your English dictionary, it's a Japanese word for measuring distances. One **_ri_** is about 4 kilometers or 2.5 miles. The kanji depicts how the measure came to be used. Atop we see the _rice field_ , and below the element for _land_. Those four sections you see in the _rice field_ (and which we made mention of when first we introduced the character in frame 14) are actually measurements of _land_ , much the same as farm-sections in the United States have given us the notion of a ""country mile."" The _land_ division based on the size of a _rice field_ is called a **_ri_**.","* To get a more concrete primitive meaning for this kanji, we shall refer to it as a _computer_ , a meaning deriving from the kanji for _logic_ , which we will meet in Lesson 12."
黒,black,"Like most things electrical, a _computer_ , too, can overheat. Just imagine _flames_ pouring out of it and charring the keyboard, the monitor, and your desk a sooty **black** color.",
墨,black ink,"Besides meaning **black ink** , this kanji also appears in the word for an inked string that is pulled taut and snapped to mark a surface, much the same as one might used a chalked string. Here it is used to mark off the _dirt_ with _black_ lines for a foot ballgame (played, I presume, on a white field).",
鯉,carp,"These are the same **carp** you see in Japanese  "" **carp** streamers. "" Only here we find a small home _computer_ or two strung on the line by a father anxious for his son not only to have the courage and determination of a **carp** swimming upstream, but also the efficiency and memory of a _computer_. Ugh.",
量,quantity,"Think of **quantity** as having to do with measuring time and distance, and the rest is simple: you have a quantity of time in the new day that begins with _nightbreak_ , and a quantity of distance in the rural _ri_.",
厘,rin,"No doubt you will find it in your heart to forgive me for forcing yet another Japanese word on you in this frame. It is not the last time it will happen in this book, but I can assure you they are used only when absolutely necessary. One **_rin_** is equal to about 1/1000 of a yen - or rather was worth that much when it still made economic sense to mint them. While inflation took its toll on this kanji as a monetary unit, it survived with the not at all surprising sense of something  ""very, very tiny."" The kanji shows a _cliff_ with a _computer_ under it, apparently because it has been pushed over into the abyss by someone fed up with the thing. The total market value of one home _computer_ that has fallen over rock and bramble for several hundred feet: about one **_rin_**!",
埋,bury,"When we speak of **burying** something (or someone, for that matter), we usually mean putting them under _ground_. Only here, we are **burying** our beloved _computer_ that has served us so well these past years. Behind us a choir chants the  ""Dies irae, dies illa"" and there is much wailing and grief among the bystanders as they pass by to shovel a little _dirt_ into what will be its final resting place. R.I.P.",
同,same,"The primitives in this kanji show us _one_ and _mouth_ under a _hood_. Let us take the key word to connote the **sameness** that characterizes the life in community of the monk. They all have the **same** habits, including the ""habit"" they wear on their backs. Here we see the monk's _cowl_ , drawn down over the eyes so that all you can see when you look at him is a _mouth_. But since monks also speak their prayers in common, it is but a short step to think of _one mouth_ under a _hood_ as the kanji for the **sameness** of monastic life.","* As a primitive, this will mean _monks_ dressed in a common habit."
洞,den,"The key word **den** refers to an animal lair hollowed out in the side of a mountain. Now if we keep to the image of the monastic life as an image for _same_ , we can picture a **den** of wild beasts dressed up in habits and living the common life in a mountain cavern. To bring in the element of _water_ we need only give them a sacred  ""puddle"" in the center of their **den** , the focus of all their pious attentions.",
胴,trunk,"The word **trunk** refers to the _part of the body_ that is left when you have "" **truncated** "" all the limbs. I can hardly think of any reason for doing so, unless one were lumberjacking corpses and needed to have them all properly pruned and made the _same_ so they could be floated downstream without causing a _body_ -jam.",
向,yonder,"Something referred to as ""over **yonder** "" is usually far off in the distance and barely within sight - like a wee _drop_ in the distance - and is usually an expression used in giving directions or pointing something out. Hence this kanji begins with a _drop_. Then we find a sort of transparent _helmet_ with no eyes or nose, but only a prominent _mouth_ under it, obviously an extraterrestrial. And what is it jabbering on about with its _mouth_ open like that? Why, about his spaceship way over **yonder** with its fuel tank on empty.",
尚,esteem,"Above we see the primitive for _little_ attached to one of those _glass canopies_ you might use to display a family heirloom. The _littleness_ is important, because what is in fact on display is the shrunken, stuffed, and mounted _mouth_ of an **esteemed** ancestor. We may be used to **esteeming** the words our forebears leave behind, but here we also **esteem** the very _mouth_ that spoke them. I leave it to you to imagine a suitable place in your room for displaying such an unusual conversation piece.",
字,character,"Here is the character for **character** itself. Not just kanji, but any written **character** from hieroglyphs to Sanskrit to our own Roman alphabet. It shows us simply a _child_ in a _house_. But let us take advantage of the double-meaning of the key word to note that just as a _child_ born to a Japanese _house_ is given **characters** for its name, so it is also stamped with the **character** of those who raise it from infancy on.",
守,guard,"The notion of **guarding** something easily brings to mind the image of someone standing **guard** , like the royal soldiers in front of Buckingham Palace or the Pope's Swiss **Guard**. The whole idea of hiring **guards** is that they should stick like _glue_ to your _house_ to protect it from unwanted prowlers. So go ahead and _glue_ a **guard** to your _house_ in imagination.",
完,perfect,"In order not to confuse the key word **perfect** with others nearly synonymous in meaning, pull it apart to have a look at its native Latin roots. _Per- factum_ suggests something so  ""thoroughly made or done"" that nothing more needs to be added to it. Now look at the kanji, which does something similar. We see a _house_ that has been made **perfectly** from its _beginnings_ in the foundation to the roof on the top. Now return to frame 101 and make sure not to confuse this key word with the kanji for _complete_.",
宣,proclaim,"Under the primitive for _house_ we meet the kanji for _span_. Think of the key word in its religious sense of missionary preaching:  "" **proclaiming** the good news to all nations "" and ""shouting it from the _housetops_. "" That should be enough to help you remember this simple kanji, used in fact both for traditional missionary work as well as for one of its contemporary replacements: advertising.",
宵,wee hours,"As the key word hints, the kanji in this frame refers to the late evening or early morning hours, well after one should be in bed asleep. It does this by picturing a _house_ with a _candle_ in it. The reason is obvious: whoever is living there is  ""burning the _candle_ at both ends, "" and working night after night into the **wee hours**.",
安,relax,"To be told that the place of the _woman_ is in the _house_ may not sit well with modern thought, but like all cultural habits the Chinese characters bear the birthmarks of their age. So indulge yourself in a Norman Rockwell image of **relaxing** after a hard day's work: the scruffy and weary _woman_ of the _house_ slouched asleep in the living room chair, her hair in curlers and a duster lying in her lap.",
宴,banquet,"To carry on from the last frame, we note the entire _day_ of work that comes between a _woman_ and her _house_ in preparing for a dinner **banquet** , pictorially ""interrupting"" her _relaxation_.",
寄,draw near,"Let the idea of **drawing near** suggest something dangerous or eerie that one approaches with fear and trembling. Here we see a _strange house_ \- perhaps the haunted _House_ of Usher that Edgar Allen Poe immortalized, or the enchanted Gingerbread _House_ that lured Hansel and Gretel to **draw near**.",
富,wealth,"Here we have the original character on which the primitive element for **wealth** is based. In keeping with the story introduced back then, note how all the **wealth** is kept under the roof of the same _house_.",
貯,savings,"To avoid confusing this frame with the last one, try to think of **savings** as actual money. The only difference is that our currency is not paper bills but _shells_ , a not uncommon unit of exchange in older civilizations. The _nail_ under the roof of the _house_ points to a hiding place in the rafters on which one strings up one's _shells_ for safekeeping.",
木,tree,"Here we see a pictograph of a **tree** , showing the main trunk in the long vertical stroke and the boughs in the long horizontal stroke. The final two strokes sweep down in both directions to indicate the roots. Although it may look similar at first sight to the kanji for _water_ (Frame 137), the order in which it is written is completely different and this affects its final appearance.","* As a primitive, this kanji can be used to mean _tree_ or _wood_. In those cases where the last two strokes are detached from the trunk, we shall change its meaning to _pole_ , or _wooden pole_."
林,grove,Learn this frame in connection with the next one. A **grove** is a small cluster of _trees_. Hence the simple reduplication of the kanji for _tree_ gives us the **grove**.,
森,forest,"A **forest** is a large expanse of _trees_ , or "" _trees_ , _trees_ everywhere, "" to adopt the expression we used back in frames 22 and 23.",
桂,Japanese Judas-tree,"Unless you are a botanist, you are not likely to know what a **Japanese Judas- tree** looks like, and probably never even heard of it before, but the name is sufficiently odd to make remembering it easy. Using the primitives as our guide, we define it as a _tree_ with _ivy_ growing down its branches in the shape of a hangman's rope.",
柏,oak,"This kanji calls to mind the famous myth of the ""golden bough."" As you may recall, what made the sacred **oak** in the forest of Diana the Huntress outside of Rome  ""golden"" were the _white_ berries of the mistletoe that grew in the branches of the tree. When the light of the sun shone through them, they turned yellow and the branch to which they clung appeared to be made of gold. (If you don't know the story, take a break today and hunt it down in a dictionary of myth and fable. Even if you forget the kanji - which of course you won't - the story of the mistletoe and the fate it brought to Balder the Beautiful is most memorable.)",
枠,frame,"You might think of the **frame** this character refers to as the sort of **frame** we have created by drawing a dark line around this kanji and its explanation. Then think of that line as made of very thin _wood_ , and finally note how each time the line bends it forms a 90° angle, thus giving us the _nine_ and the _ten_.",
梢,treetops,"As the days grow shorter and shorter, or so the northern European myth goes, the fear grows that the sun will take its leave of us altogether, abandoning the world to total darkness. Fixing _candles_ to the branches of evergreen _trees_ , it was believed, would lure the sun back (like things attracting like things), whence the custom of the lighted tree that eventually found its way into our Christmas customs. The story is a lot longer and more complex than that, but it should help to fix the image of climbing high up into the **treetops** to fix _candles_ on the _tree_.",
棚,shelf,"One often thinks of books as ""good _companions_ ,"" but here it is the **shelf** we store them on that is the _companion_. The reasons should be obvious: it is made of the same stuff, _wood_ , and spends a lot more time with them than we do! Here again, be careful not to let the rationality of the explanation get in the way before you turn it into a proper story.",
杏,apricot,"Since **apricots** can be eaten just as they fall from the _trees_ , picture this _mouth_ agape at the bottom of a _tree_ (just as the elements have it), waiting for **apricots** to fall into it.",
桐,paulownia,"Since you probably don't know what a **paulownia** _tree_ is, we shall let the key word suggest the phrase  ""the Little Brothers of St. **Paulownia.** "" It is a short step to associate the _tree_ with the _monks_ to its right. (For the curious, the name of this oriental _tree_ really comes from a Russian princess, Anna Pavlovna.)",
植,plant,You have no doubt seen how people practicing the Japanese art of bonsai take those helpless little saplings and twist them into crippled dwarves before they have a chance to grow up as they should. The more proper way to **plant** a young _tree_ and give it a fair shake in life is to set it into the earth in such a way that it can grow up _straight_.,
椅,chair,"Instead of making a **chair** out of wood from a _tree_ , this kanji has us making the whole _tree_ into a **chair** , which looks most _strange_ sitting in your living room where the sofa used to be.",
枯,wither,"What makes a _tree_ begin to **wither** up, and perhaps even die, is a kind of arteriosclerosis that keeps its sap from flowing freely. Usually this is due to simple _old age_ , as this character shows us. Be sure to picture a wrinkled _old tree_ , **withering** away in a retirement center so that the commonsense explanation does not take over.",
朴,crude,"As all magicians who have passed their apprenticeship know, one makes one's _wand_ out of a hazel branch and is careful not to alter the natural form of the _wood_. For the magic of the _wand_ derives its power from its association with the hidden laws of nature, and needs therefore to be kept in its **crude** , natural state.",
村,town,"The character for _village_ was associated with _rice fields_ (Frame 96). That for **town** , a step up on the evolutionary path to cities, shows a circle of _trees glued together_ to measure off the confines of a **town**.",
相,inter-,"The prefix **inter-** stirs up associations of cooperation among people. From there we read off the elements: _tree_ . . . _eye_. With only a slight leap of the imagination, those two words call to mind the scriptural proverb about first taking the block of timber out of one's own _eye_ before helping your neighbors with the splinter in theirs. What more useful rule for **inter-** human relationships, and what more useful tool for remembering this kanji!",
机,desk,"We need to fix imagination here on two things to learn the kanji for **desk** : the wonderful rough _wood_ of which it has been hewn and the _wind_ that blows across it, sending your papers flying all over the room. These two elements, written in that order, dictate how to write the character.",
本,book,"Recalling that **books** are made of paper, and paper made of _trees_ , one might think of a **book** as a slice of a _tree_. Can you seethe  ""cross-cut"" in the trunk of the _tree_? Picture it as a chainsaw cutting you out a few **books** with which to start your own private library.",
札,tag,"The **tags** you see hanging on _trees_ in public places in Japan are helpful to identify what sort of _trees_ they are. Next time you see one, imagine the bit of wire that fixes the **tag** to the branch as a large _fishhook_. REALLY imagine it, illogical as it is, and you will never have trouble with this kanji again.",
暦,calendar,"Look at this character in reverse order, from bottom up. First we see the primitive for _days_ , an appropriate enough way to begin a **calendar**. Next we see a _grove of trees_ growing under a _cliff_. The laws of nature being what they are, the _trees_ would be stunted under such conditions, unless they were strong enough to keep growing upwards until they passed through the layers of rock and soil, right up to the surface. Now imagine that in those little boxes marking off the _days_ on your wall **calendar** , you see that very process taking place step by step: 365 or so time-lapse pictures of that _grove of trees_ each month, from January under the _cliff_ to December on top of the _cliff_. The story is not as complex as it sounds, particularly if you happen to have a **calendar** nearby and can flip through it with this image in mind.",
案,plan,"Without much effort, the elements _relax_ . . . _tree_ suggest a hammock strung between two _trees_ in your backyard, and you stretched out in it, hands folded behind your head, **planning** something or other. After all, it's something we all do from time to time: kick up our legs on the nearest piece of furniture and daydream about the best **plan** of action to take. Be sure to relate the _relaxation_ to the _tree_ , so that you don't end up with something else in its place (like ""legs"" or ""desk"" or ""table"").",
燥,parch,"**Parch** ment, made from animal skins, was the most common form of writing material used until the beginning of the nineteenth century. When paper took over, a method was devised to make artificial **parch** ment from _wood_ pulp. The _fire_ at the left and in the  ""strong"" position serves to remind us of the root word, "" **parch** ,"" since nothing dries, puckers, wrinkles, and scorches quite like _fire_. And here is how we put it all together. Take a sheet of paper (a  "" _wood-good_ ,""), wet it, and hold it over a _hearth_ in your mind's eye. Now watch as it **parches** the paper, leaving it with a strange and bumpy surface resembling **parch** ment.",
未,not yet,"As the key word suggests, this kanji has to do with something not quite over and done with. More concretely, it shows us a _tree_ that is **not yet** fully grown. The extra short stroke in the upper branches shows new branches spreading out, leaving one with the feeling that the _tree_ has a ways to go yet before it reaches maturity. In other words, the kanji conveys its meaning pictographically, playing on the earlier pictograph of the _tree_.",
末,extremity,"This character is best learned in connection with that of the previous frame. The first stroke shows a branch that is longer than the main branch, indicating that the tree has reached the **extremity** of its growth, so that its branches stop spreading and start drooping downwards. Be sure to keep this imagery in mind, to avoid confusing this key word with synonyms that will appear later.",
昧,obscure,"The most **obscure** ideas are those that the _sun_ of reason has _not yet_ dawned on. Be sure to give the _sun_ a professorial demeanor, complete with spectacles and a pipe.",
沫,splash,"The **splash** this kanji refers to is the dash of _water_ against the rocks, with all the foam and spray that this creates. If you think of a **splash** in this sense as a wave that has run its full course and reached its _extremity_ , namely the seashore, and if you think of it pictorially in your mind's eye, this somewhat rare (but oh so-easy-to-learn) kanji is yours for good.",
味,flavor,"When a tree has _not yet_ finished growing, it produces fruit with a full **flavor**. When the official taster (the professional _mouth_ to the left) determines that full flavor has been reached, the tree is pruned back so that it remains permanently _not yet_ grown. A neat little agricultural trick and an easy to way see the sense of **flavor** hidden in this character.",
妹,younger sister,"The **younger sister** in the family is the _woman_ in the family who, like the newest branch in a tree, is _not yet_ old enough or mature enough to do everything the elder sister can do (See frame 442).",
朱,vermilion,"That red-orange color we call **vermilion** is found in nature during the fall when the leaves lose their sugar and begin to change color. This kanji depicts the very last leaf on a tree in the fall (the _drop_ hung in the first stroke), the leaf that has _not yet_ fallen as it one day must. Look at its color - vermilion. (Well, not really. The truth is, **vermilion** is made from a mercuric sulfide, but I'm sure you will agree that autumn leaves area lot easier to work with.)",
株,stocks,"The **stocks** bought and sold on the market by the tens of millions each day get their name from a comparison to a healthy _tree_ , in which one takes "" **stock** "" in the hopes that it will grow and produce more and more _trees_ like itself. Usually good **stocks** are referred to as  ""blue chip,"" but here we are asked to associate the key word with the color _vermilion_ , perhaps because one can assess the value of a tree from the color of its autumn leaves.",
若,young,"Here we see a _flower_ held in the _right_ hand. You can imagine yourself in a magic garden where _flowers_ picked with the _right_ hand grant eternal **youth** , and those picked with the left, premature senility. Go ahead, pick one with each hand and watch what happens.",
草,grass,"Perhaps you know the custom of seeding **grass** randomly or in some particular pattern with the _flower_ called the crocus, which blooms for a few days each year in _early_ spring. As the **grass** begins to turn green again after winter has passed, these tiny _flowers_ dot up here and there. Now just look out your window at a patch of **grass** somewhere and think what a nice idea it would be to have your name spelled out in _flowers_ once as a sort of _early_ harbinger of spring.",
苦,suffering,"The picture of **suffering** we are given here is that of a _flower_ that has grown _old_. When a _flower_ ages, it pales and dries up, and probably even **suffers**. If you think that plants are incapable of such feelings, then ask yourself why so many people believe that talking to their flowers helps them bloom better.",
苛,bullying,"A nosegay of _flowers_ make a nice gift, but if those flowers are poison oak, they _can_ amount to **bullying**. Be sure to emphasize the word _can_ when you repeat this little phrase to yourself.",
寛,tolerant,"The _house_ of _flowers_ or  ""hothouse"" has become a metaphor for a narrow- minded, biased, and intolerant attitude distrustful of change. **Tolerance** , in contrast, is open-minded and welcomes novelty. The way to encourage **tolerance** in those who lack it is first to have them _see_ through their own hothouse attitudes, which is the very counsel we are given in this kanji.",
薄,dilute,"Take a good look at this kanji: the ""strong"" element here is really the _flower_ , not the _water_ as you might have thought on first glance. To the right is the _acupuncturist_ from frame 48. Taking the key word to connote **diluting** the vital humors of the body, we can imagine our _acupuncturist_ performing his task with _flowers_ in place of needles, and using their hollow stems to pipe _water_ into the body of the patient.",
葉,leaf,"Three elements are given here: _flower_ . . . _generation_ . . . _tree_. The first and last seem logical enough, since it is the **leaf** that feeds the _flowers_ on a _tree_. The element for _generation_ interposed between the two suggests that the movement of a _tree_ from one _generation_ to the next is like its  ""turning over a new **leaf**. """,
模,imitation,"Ah, but haven't modern _graveyards_ become a parody of their ancestors! The flowers are plastic, the writing on the stones is unimaginative and cold, and the whole thing looks more like a marble orchard than a right and proper graveyard. This kanji continues with the modernization trend by picturing **imitation** _trees_ in the _graveyard_. But of course, how convenient! They don't need pruning or fertilizing, their leaves don't fall, and they remain the same color all year long.",
漠,vague,"Think of the key word as having to do with something viewed through a haze, or in the twilight and from a distance, so that only its outlines are **vaguely** discernible. Now we are back again to the essence of the true _graveyard_. The _water_ may be taken as the sound of waves dashing up against the rocks or the dripping of moisture on cold rock - anything that helps you associate **vagueness** with the _graveyard_ and keep it distinct from the imitation we met in the last frame.",
