kanji,english,explanation,primitive
壊,demolition,"The right half of this character shows a _garment_ woven so fine that it can pass through the _eye_ of a _needle_ , fittingly draped around the slithering, ethereal form of a poltergeist. In this frame, our eerie visitor brushes its robes against a nearby block of apartments and completely **demolishes** them, razing them to the _ground_.",
哀,pathetic,A drunken sod in a tattered _top hat_ and soiled silk _scarf_ with a giant _mouth_ guzzling something or other gives us a **pathetic** character role in which W. C. Fields might find himself right at home.,
遠,distant,A **distant** figure on the _road_ is such a blur it looks like a _lidded crock_ wearing a silk _scarf_.,
猿,monkey,"This clever little **monkey** has captured an entire pack of _wild dogs_ , locked them inside a _lidded crock_ , and wrapped the whole thing up in a silk _scarf_ to present to the dogcatcher.",
初,first time,"The primitives here take care of themselves: _cloak_ and _dagger_ .What I leave to you is to decide on an appropriate connotation for  "" **first time** "" to take advantage of them.",
巾,towel,This character depicts a bolt of cloth wrapped around a pole. From there it gets its meaning of a **towel**.,
布,linen,"The maid, _towels by her side_ , distributes the **linen**.",
帆,sail,A **sail** made of a _towel_ makes a _mediocre_ vessel.,
幅,hanging scroll,A _towel_ owned by the _wealthiest_ tycoon in the world is made into a **hanging scroll** after his death and auctioned off to the highest bidder.,
帽,cap,"Because of the _risk_ involved (of getting the _sun_ in one's _eyes_ ),one puts together a makeshift **cap** out of a dirty old _towel_.",
幕,curtain,A dirty _towel_ draped over the entrance to the old _graveyard_ is painted to look like the **curtain** of death that leads to the otherworld.,
幌,canopy,A large _towel_ stretched overhead with only a few of the _sun's rays_ breaking through represents a **canopy** over one's bed.,
錦,brocade,A strip of _white towel_ and some scraps of _metal_ have the makings of a primitive kind of **brocade**.,
市,market,"Dressed in nothing but a bath _towel_ and _top hat_ , one sets off to the **market** place in search of a bargain or two.",
柿,persimmon,"Imagine a village _market_  with stalls set up around an immense **persimmon** _tree_  with watermelon-sized fruit. If it weren't for the fact that the _tree_  is sacred to the village, people would get impatient as the **persimmons**  fall from the _tree_  and wreak havoc on buyers and sellers alike.",
姉,elder sister,"Of all the _women_ of the family, it is the **elder sister** who has the duty to go to _market_ to do the shopping.",
肺,lungs,"One is surprised, strolling through the _market_ , to find among the _meats_ hung out for sale a slab marked: **lungs**.",
帯,sash,The part of the _apron_ where one finds the _buckle_ (represented pictorially by the first 5 strokes) is on the **sash**.,
滞,stagnate,"People that have been "" _sashed_ "" to something (whether their mother's apron strings or a particular job) for too long become like _water_ that has stopped moving: they start to **stagnate**.",
刺,thorn,"**Thorns** grow on a bush here that has wrapped itself around a _tree_ like a _belt_ , cutting into the poor _tree_ like little _sabers_.",
制,system,"This kanji show a unique **system** for leading _cows_ to the slaughterer's _saber_ : one ties a _belt_ about their waist and fixes that _belt_ to an overhead cable, pulling the _cow_ up into the air where it hangs suspended, helpless against the fate that awaits it.",
製,made in...,A label indicating that a _garment_ was **made in** U.S.A. or Taiwan or Japan is itself a symbol for the _systematization_ of the _garment_ industry.,
転,revolve,"As the wheels of the _car_ **revolve** , they kick up small _rising clouds_ of dust and debris behind them.",
芸,technique,The secret **technique** of making a _rising cloud_ of smoke turn into a bouquet of _flowers_ is shown here.,
雨,rain,"This kanji, also a primitive, is one of the clearest instances we have of a complex pictograph. The top line is the sky, the next 3 strokes a pair of clouds, and the final 4 dots the **rain** collected there and waiting to fall.","* As a primitive it can mean either _rain_ or _weather_ in general. Because it takes so much space, it usually has to be contracted into a crown by shortening the second and third strokes into a crown."
雲,cloud,"Here is the full character for **cloud** from which the primitive for a _rising cloud_ derives. _Clouds_ begin with vapors _rising_ up in small _clouds_ from the surface of the earth, and then gathering to make **clouds** that eventually dump their _rain_ back on the earth.",
曇,cloudy weather,We refer to days when the _sun_ is covered by the _clouds_ as **cloudy weather**.,
雷,thunder,"The full rumble and roar and terror of **thunder** is best felt not with your head tucked under your pillow safe in bed, but out in an open _rice field_ where you can get the real feel of the _weather_.",
霜,frost,"Think of **frost** as a cooperative venture, an _inter_ -action of the malevolent forces of _weather_ that sit around a conference table and finally decide to allow a very light amount of moisture to fall just before a short and sudden freeze.",
冬,winter,_Walking legs_ slipping on the _ice_ are a sure sign of **winter**.,
天,heavens,"This character is meant to be a pictograph of a great man, said to represent the Lord of the **Heavens**. (You may, of course, use the elements _ceiling_ and _St. Bernard_ instead.)","* The primitive can mean either the _heaven_ of eternal bliss or the general term for sky, the _heavens_. Pay special attention to the fact that in its primitive form the first stroke is written right to left, rather like the first stroke of thousand (Frame 40), rather than left to right. From the next character, we shall give it the primitive meaning of a _witch_."
妖,bewitched,"You are **bewitched**  by a _woman_ who is, of course, a _witch_.",
沃,irrigate,"Suffering from a drought, the farmers call on a _witch_  who conjures up _water_  to **irrigate**  their crops.",
橋,bridge,"The **bridge** shown here is made of _trees_ in their natural form, except that the trunks have been carved into the forms of _angels_ , a sort of ""Ponte degli Angeli.""",
嬌,attractive,Associating a particularly **attractive** _woman_ you know with an _angel_ should be no problem.,
立,stand up,This picture of a vase **standing up** has its meaning extended to represent the general posture of anything **standing up**.,"* Used as a primitive, it can also mean _vase_. Using its kanji meaning, think of something _standing up_ that is normally lying down, or something standing up in an unusual way."
泣,cry,One **cries** and **cries** until one is _standing up_ knee-deep in _water_ (or until one has a _vase_ -full of _water_ ).,
章,badge,Try to imagine a club **badge** pinned to your lapel in the form of a mammoth _sunflower_ protruding from a wee little _vase_.,
競,vie,"Two _teenagers_ are seen here _standing up_ to one another, **vying** for the attention of their peers.",
帝,sovereign,"An uncommon, but not altogether unlikely picture of a reigning **sovereign** has him _standing up_ in his _apron_ , presumably at the behest of HIS **sovereign** (she who is to be obeyed), who needs help with washing the dishes.",
諦,renunciation,"The key word **renunciation**  has to do with the wisdom and clarity of mind in knowing when to ""let go."" This is what makes the  _words_  of acquiescense _sovern_.",
童,juvenile,"This frame shows up the image of a **juvenile** hacker _standing_ on top of a _computer_ , or rather jumping up and down on it, because it refused to come up with the right answer.",
瞳,pupil,"Begin with the double meaning of the key word **pupil** : ""student"" and the ""the apple of one's _eye_. "" Now all you have to do is dwell on the phrase "" _juvenile_ of one's _eye_ "" (the meaning here) until it provides you with an image.",
鐘,bell,"This **bell** is made of cheap _metal_ , and so badly made that when you ring it, it lets out a noise like the "" **bell** owing"" of _juveniles_ who aren't getting their own way.",
商,make a deal,"See the peddlar _standing_ atop his _motorcycle helmet_ as if it were a soapbox, hawking his wares to passersby. The _legs_ and _mouth_ represent the tools of the trade of **making a deal** any way you can.",
嫡,legitimate wife,"The phrase **legitimate wife** would have no meaning if there were not such things as  ""illegitimate wives,"" taken because one's legal _woman_ has turned into an _antique_. The very offense of the idea should help you remember the kanji.",
適,suitable,Can you imagine anything less **suitable** to do with one's precious _antiques_ than to display them in the middle of a crowded _road-way_?,
滴,drip,"Picture _water_ **dripping** on what you thought were precious _antiques_ , only to find that the artificial aging painted on them is running!",
敵,enemy,"Picture your most precious _antique_ (it doesn't matter how old it really is, so long as it is the oldest thing YOU own) being knocked over by your most unlikeable _taskmaster_ , and you have a good picture of how people make themselves **enemies** for life.",
匕,spoon,"This character, a pictograph of a **spoon** , is easy enough to remember, provided you keep it distinct from that for _seven_ , where the first stroke is written left to right (the opposite of here) and cuts noticeably across the second.","* As a primitive, this kanji can take on the additional meaning of someone _sitting on the ground_ , of which it can also be considered a pictograph. In general, the second stroke does not cut through the first - or if it does in some fonts, only slightly."
叱,scold,"Recall some particularly harsh **scolding**  you got as a child in school. This character has you _sitting on the ground_  in the corner as your teacher stands over you, her _mouth_  wide open as she reprimands you in front of the entire class.",
匂,aroma,"You will have to imagine ""capturing"" a favorite **aroma** by having it gagged and _bound up_  in a _spoon_.",
頃,about that time,"When Uncle Bob starts his comic routine of sticking _spoons_ on his _head_ , you know it is **about that time**  to come up with a reason to excuse yourself.",
北,north,"The cold air from the **north** is so strong that we see _two people sitting on the ground_ back to back, their arms interlocked so they don't blow away. (Pay special attention to the drawing of the first 3 strokes.)",
背,stature,"One's **stature** is measured according to the  "" _northern_ -most"" _part of the body_.",
比,compare,"With _two spoons_ , one in each hand, you are **comparing** your mother's cooking with your mother-in-law's.",
昆,descendants,"By _comparing_ apes with anthropoids, we not only discover the latter have **descended** from those progenitors educated in the higher branches, but that the very idea of seeing everything **descended** from everything else, one way or another, means that there is  ""nothing new UNDER the _sun_. """,
皆,all,"Think of the housewives in TV commercials "" _comparing_ the _whiteness_ "" of their laundry across the fence, a typical advertisement for the popular detergent known as **All**. (If you don't know the brand, surely you've heard the phrases  "" **all** -purpose detergent"" or "" **all** -temperature detergent."")",
楷,block letters,"The key word refers to kanji that are written in full, squared form, as opposed to cursive writing which is more flowing andabbreviates some of the strokes. Here **block letters** are pictured as tidy rows of _trees_ that are _all_ the same size and can be read easily by _all_ , whatever calligraphic skills they possess.",
諧,orderliness,"The harmoney of ""a place for everything and everything in its place"" is applied here to the **orderliness** of _all_ the _words_ one speaks.",
混,mix,"**Mixed** marriages, this character suggests, _water_ down the quality of one's _descendants_  \- the oldest racial nonsense in the world!",
渇,thirst,"As you pass by the muchacho taking the _siesta_ , he cries out that he is **thirsty** and asks for something to drink. So you turn the _water_ hose on him.",
謁,audience,"Imagine an **audience** with the emperor or the pope in which all those in attendance are sitting down, leaning against the wall, sleeping like our muchacho on _siesta_ as the honorable host delivers his _speech_.",
褐,brown,"The color of the serape or _cloak_ of our muchacho on _siesta_ is a dull **brown** , the color this kanji indicates.",
喝,hoarse,"When the muchacho on _siesta_ looks up at you and opens his _mouth_ to talk, his voice is so **hoarse** that you cannot understand him.",
葛,kudzu,"**Kudzu**  is a word taken over from Japanese to name the crawling vines that creep up and completely take over trees. Seeing it at its worst in the Georgia countryside makes it easy to understand why it has a reputation as the ""plague of the South."" From there it should not be hard to arrange the primitives, _flowers_  and _siesta_  into a memorable image.",
旨,delicious,Something is so downright **delicious** that one spends the entire _day_ with a _spoon_ in hand gobbling it up.,
脂,fat,"This kanji tells us that if you feed the _flesh_ with too many _delicious_ things, it soon picks up a thick layer of **fat**.",
詣,visit a shrine,"Here you ""savor your _words_ "" as something _delicious_  when you describe your recent **visit to a shrine**  or pilgrimage site.",
壱,I (one),"The Roman numeral I - like that for II we met earlier in frame 379 - is only rarely used now. In the midst of all the _samurai_ , we notice one in particular _sitting on the ground_ with a _crown_ on his head, indicating that he is  ""number I"" in the current rankings.",
毎,every,"Behind **every** successful person _lies_ a woman...,  who usually turns out to be one's _mama_!",
敏,cleverness,"Behind _every_ successful _taskmaster_ , the **cleverness** of a fox to outwit his charges.",
梅,plum,"Behind _every_ Jack Horner's pie maker, a _tree_ full of **plums**.",
海,sea,"Behind _every drop of water_ , a **sea** from which it originated.",
乞,beg,"See someone _lying down_ in a public place with a _hook_ in place of a hand, **begging** a morsel of rice or a few pence.",
乾,drought,In times of **drought** anything at all will do. Here we see the victims _begging_ for just a little _mist_ for relief.,
腹,abdomen,"If you _double back_ (fold over) most animals - or people, for that matter - in the middle, the _part of the body_ where the crease comes is the **abdomen**.",
複,duplicate,"In its original and etymologically transparent sense, to **duplicate** something means to _double_ it _back_ with a fold, like the fold of a _cloak_.",
欠,lack,"The pictograph hidden in this character is of someone yawning. The first stroke shows the head thrown back, the second, the arm bent at the elbow as the hand reaches up to cover the mouth, and the last two, the legs. Since yawning shows a **lack** of something (psychologically, interest, physiologically, sleep), the connection is plain to see.","* As a primitive, it can mean either _yawn_ or _lack_."
吹,blow,To **blow** is really no more than a deliberate effort to make one's _mouth lack_ all the air that is in it.,
炊,cook,"Better to picture what happens when you do not pay attention to your work in the kitchen. Here we see a blazing _fire_ and an inattentive, _yawning_ **cook** who let things get out of control.",
歌,song,"The **song** in this kanji is being sung by a chorus line of _can-can_ girls. Why it should be eliciting nothing but _yawning_ from the audience, I leave to you to decide.",
軟,soft,"If the cushions of one's _car_ are too **soft** , one may begin _yawning_ at the wheel.",
次,next,"This key word connotes the "" **next** in line "" of a succession of people or things. Let there be a _lack_ of _ice_ on the hottest day of summer, and you stand impatiently in line waiting for the distributor to call out  "" **Next**! ""","* As a primitive, this character can either retain its key word meaning of _next_ or the related meaning of _second_."
茨,briar,"Earlier we made mention of the story of **Briar** Rose (or  ""Sleeping Beauty,"" as we called her in frame 165) and drew attention to the **briar** hedge that grew up all about her castle. But in the _second_ part of the story, these **briars** blossomed into _flowers_. Hence her name, **Briar** Rose. Be careful not to confuse this character with that for _thorn_ (Frame 446).",
資,assets,"The first _shells_ (money) you earn, you use to pay your debts. From then on, the _next shells_ you accumulate become your **assets**.",
姿,figure,This kanji depicts a _woman's_ **figure** as a sort of _second_ self.,
諮,consult with,To seek the _words_ of a _second mouth_ is to **consult with** someone about something.,
賠,compensation,Picture a _clam_ used as a _muzzle_ to quiet the complaints of a fisherman's widow asking **compensation** for her husband lost at sea.,
培,cultivate,The barrel hoops used by many Japanese farmers to stretch clear plastic over row of vegetables in a garden patch in the hopes of **cultivating** bigger and bigger vegetables is a way of _muzzling_ the _soil_.,
剖,divide,"To "" **divide** and conquer "" you use a _saber_ and a _muzzle_.",
音,sound,"The kanji for **sound** depicts something _standing_ in the air over a _tongue wagging in a mouth_ , much the same as a **sound** does for the briefest of moments before disappearing.",* The primitive from this kanji also means simply a sound.
暗,darkness,"When "" **darkness** covered the earth "" at the beginning of time, there was neither _sun_ nor _sound_.",
韻,rhyme,"Poetry restricted to verses that **rhyme** often finds it has to abandon clarity of thought in order to make the **rhyme** of the words work. In this kanji's picture, one becomes a kind of  "" _sound-employee_. """,
識,discriminating,A person of **discriminating** intellect can tell the difference between mere _kazoo_ -buzzing and _words_ spoken wisely.,
鏡,mirror,"After lakes but before glass, polished _metal_ was used for **mirrors**. These _metal mirrors_ are recalled in this character for a **mirror**.",
境,boundary,Imagine the **boundary** of a plot of _land_ marked with gigantic _mirrors_ enabling the landowner to keep trespassers in sight at all times.,
亡,deceased,"A _top hat_ hanging on a _hook_ in the front hall, right where the **deceased** left it the day he died, reminds us of him and his kanji.","* In addition to _deceased_ , the primitive meaning of _to perish_ will also be used for this character."
盲,blind,"If one's _eyes perish_ before death, one remains **blind** for the rest of life.",
妄,delusion,"The ""ideal _woman_ "" one daydreams about is no more than a **delusion**. Hence, _perish_ the thought of her.",
荒,laid waste,The _flowers_ that _perish_ in the _flood_ are taken here as symbols of an area that has been **laid waste**.,
望,ambition,"The story of **ambition** talks of a _king_ walking under the _perishing_  (or ""waning"") _moon_ dreaming great dreams about his kingdom. (The roots of **ambition** are from the same word as  ""ambulate,"" meaning to walk about.)",
方,direction,Spinning a _dagger_ about on its hilt on the top of a _top hat_  \- waiting to see in which **direction** it points when it comes to rest - one leaves to fate where one is going next. Take care in writing this character.,"* As a primitive, this character will take the sense of a _compass_ , the instrument used to determine _direction_."
妨,disturb,"Imagine a _compass_ that is **disturbed** every time a _woman_ passes by, sending the needle spinning madly round and round.",
坊,boy,"The character for a **boy** shows us a **Boy** Scout cleaning the _dirt_ out of his _compass_  \- the more _dirt_ , the better.",
芳,perfumed,Here we see a special _compass_ used to pick out those _flowers_ most suited for making good **perfumes**.,
肪,obese,"If you eat too much, you may need a _compass_ to find your way around the **obese** mass of _flesh_ that piles up in the midsection. Compare this with your stories for _round_ (Frame 44) and _fat_ (Frame 494), similar in meaning but distinct in imagery.",
訪,call on,"When making a courtesy **call on** a dignitary, one has to gauge one's _words_ with great care. Hence the need for a _compass_.",
放,set free,"The _taskmaster_ **sets** an unruly servant **free** , giving him no more than a quick glance at the _compass_ and a boot from behind.",
激,violent,"Some cosmic _taskmaster_ hovering overhead whips up the waves to make them dash **violently** against the shore. In the _white_ foam that covers the _water_ we see a broken _compass_ floating, all that remains of a shipwreck.",
脱,undress,"To **undress** is to expose the _flesh_ and tempt the _devil_ in the eyes of one's onlookers. Ignore the moral if you want, but not the _devil_.",
説,explanation,"Not inappropriately, this character likens an  **explanation** to the _devil's_ own _words_.",
鋭,pointed,"_Metal_ that has been **pointed** (as an awl, a pick, a nail, or a knife) tends to serve the _devil's_ purposes as well as civilization's: our tools are also our weapons.",
曽,formerly,"This primitive (named for its associations with the kanji of the following frame) is composed of a pair of _horns_ growing out of a _brain_ with a _tongue wagging in the mouth_ beneath. Think of  "" **former** "" in connection with administrators or heads of state who have just left office but continue to make a nuisance of themselves by advertising their opinions on public policy.","* The primitive meaning, _increase_ , comes from the next frame. Always think of something multiplying wildly as you watch."
増,increase,"This kanji depicts an **increase** of _soil_ , multiplying so fast that it literally buries everything in its path.",
贈,presents,"The **presents** offered here are _money_ that _increases_ each time you give it away. Do not confuse with the temporal word  ""present"" (Frame 275).",
東,east,"As a ""Western"" language, English identifies the **east** with the rising _sun_. In more fanciful terms, we see the _sun_ piercing through a _tree_ as it rises in the **east**.","* Both the direction _east_ and the part of the world called  ""the _East_ "" are primitive meanings of this character."
棟,ridgepole,"If the piece of _wood_ in the roof known as the **ridgepole** points _east_ , the sunrise will be visible from the front door.",
凍,frozen,"The whole secret to breaking the _ice_ with the _East_ is to peek behind those mysteriously  "" **frozen** smiles. """,
妊,pregnancy,"A _woman_ who is in her **pregnancy** is a bit like a _porter_ , bearing her new companion wherever she goes.",
廷,courts,"Those who rule the **courts** , the _porters_ of justice and order, are often found to _stretch_ the law to suit their own purposes. Recall the kanji for _prolong_ from frame 419 and keep it distinct.",
染,dye,"_Water_ . . . _nine_ . . . _tree_. From those elements you must compose a plot for the key word, **dye**. Here, as elsewhere, any of the alternate meanings of the primitives may be used, provided they do not require a position other than that of the kanji in question.",
燃,burn,"_Hearth_ . . . _sort of thing_. Beware of letting the simple reading off of the primitive elements do your work for you. Unless you make a vivid image of something **burning** and relate it just as vividly to those primitive meanings, you can count on forgetting this character very quickly.",
賓,V.I.P.,The **V.I.P.** indicated here is an important guest making a visit. The elements are: _house_ . . . _ceiling_ . . . _few_ . . . _shells_.,
歳,year-end,_Stop_ . . . _march_ . . . _little_. Be sure not to forget that final dot in the element for _march_.,
県,prefecture,"Above, an _eye_ and a _fishhook_ , and below the primitive for _little_. Although apparently the simplest of these first six kanji, when you begin to work on its plot and story you will soon find out that the number of strokes and visual complexity of a kanji does not make it easier or harder to remember. It is the primitives you have to work that are the critical factor, as in this case where the meaning of the key word is so seemingly distant from the elements. Remember, you can always break larger elements down ( _eye of a needle_ into _eye_ and _fishhook_ ) if you think it helps.",
栃,horse chestnut,A tree . . . cliff . . . ten thousand.,
地,ground,"_Soil_ and a _scorpion_ (an  ""earth animal""). This is, of course, the full character from which the primitive for **ground** derives.",
池,pond,"_Water_ . . . _scorpion_. It would be easy to slip into a  ""lazy image"" in cases like this one, picturing, let us say, a _scorpion_ near the _water_. But if you picture rather a _scorpion_ letting its venom out _drop by drop_ until it has made a whole **pond** of the stuff, the image is more likely to remain fixed.",
虫,insect,Work with the pictograph as you wish.,"* As a primitive, this insect will refer to the whole _insect_ kingdom, it can be further specified for each kanji that contains it."
蛍,lightning bug,Schoolhouse . . . insect.,
蛇,snake,Insect . . . house . . . spoon.,
虹,rainbow,Insect . . . craft.,
蝶,butterfly,Insect . . . generation . . . tree.,
独,single,Think of this key word in connection with bachelorhood. The elements: _wild dogs_ . . . _insect_.,
蚕,silkworm,_Heavens_ . . . _insect_. Be sure to do something about the position of the two elements.,
